{
  "schema_version": 2,
  "source_root": ".",
  "package": {
    "id": "deadtrigger",
    "version": "1.0.7",
    "profile": "universal-portmaster",
    "launcher": "Dead Trigger.sh",
    "launcher_chain": [
      "Dead Trigger.sh"
    ],
    "launcher_contract": {
      "generator": "nxbootstrap",
      "version": "0.6.4",
      "config_path": "deadtrigger/nxport.json",
      "config_sha256": "3e8132eb25c638f87c725f0282249e3aa96248d460ace18744ced128af02f8e9"
    },
    "port_dir": "deadtrigger",
    "license": {
      "spdx_id": "GPL-3.0-only",
      "source_url": "https://github.com/NextOs-Ports/nextos_ports_android",
      "file": "deadtrigger/LICENSE"
    }
  },
  "release": {
    "source_date_epoch": 1786406400,
    "max_glibc": "2.30",
    "compression": "deflated"
  },
  "nxextract": {
    "path": "deadtrigger/nxextract/nxextract.py",
    "version": "1.2.6",
    "minimum_version": "1.2.6",
    "sha256": "a4a8e5d3bf2a1344491e27921c54430ee9b4e3fedd0160631da96734fa3d5170",
    "runner_path": "deadtrigger/nxextract/run-extractor.sh",
    "runner_sha256": "179b72f02b9dfdf3ed1bdc382d074fb4ef07f83e3d62cfccfc74a950e68679c2",
    "runtime_env_path": "deadtrigger/nxextract/nxextract-runtime-env.sh",
    "runtime_env_sha256": "332919a9960d4317563b647f9932d1a4367da147a425fe2f78eafd706f01563f",
    "recipe_path": "deadtrigger/extractor.json",
    "recipe_sha256": "03361a5efc93bcc87709bc5fe7aa3dbb1f855e74c4cccb2f5e534dd7c668ee79"
  },
  "dependencies": [
    {
      "namespace": "linux",
      "architecture": "aarch64",
      "soname": "libSDL2-2.0.so.0",
      "provider": "portmaster"
    },
    {
      "namespace": "linux",
      "architecture": "aarch64",
      "soname": "libEGL.so",
      "provider": "firmware"
    },
    {
      "namespace": "linux",
      "architecture": "aarch64",
      "soname": "libGLESv2.so",
      "provider": "firmware"
    },
    {
      "namespace": "linux",
      "architecture": "aarch64",
      "soname": "libc.so.6",
      "provider": "glibc-base"
    },
    {
      "namespace": "linux",
      "architecture": "aarch64",
      "soname": "libdl.so.2",
      "provider": "glibc-base"
    },
    {
      "namespace": "linux",
      "architecture": "aarch64",
      "soname": "libgcc_s.so.1",
      "provider": "firmware"
    },
    {
      "namespace": "linux",
      "architecture": "aarch64",
      "soname": "libm.so.6",
      "provider": "glibc-base"
    },
    {
      "namespace": "linux",
      "architecture": "aarch64",
      "soname": "libpthread.so.0",
      "provider": "glibc-base"
    },
    {
      "namespace": "linux",
      "architecture": "aarch64",
      "soname": "libz.so.1",
      "provider": "firmware"
    }
  ],
  "portmaster_metadata": {
    "port_json": {
      "path": "deadtrigger/port.json",
      "sha256": "a18a2905c7e6c7ea626911f48f2924db8133a64d8a7903ccc2b47400dc60cd1f"
    },
    "images": []
  },
  "files": [
    {
      "source": "Dead Trigger.sh",
      "target": "Dead Trigger.sh",
      "kind": "launcher",
      "mode": "0755",
      "sha256": "8c836132f9018595be97539bf52309dbe0957a1f795afeeda54977f33f301f18"
    },
    {
      "source": "nxport.json",
      "target": "deadtrigger/nxport.json",
      "kind": "nxbootstrap-config",
      "mode": "0644",
      "sha256": "3e8132eb25c638f87c725f0282249e3aa96248d460ace18744ced128af02f8e9"
    },
    {
      "source": "build/deadtrigger-nextos",
      "target": "deadtrigger/deadtrigger-nextos",
      "kind": "project-linux",
      "mode": "0755",
      "architecture": "aarch64",
      "build_profile": "universal-low-glibc",
      "provenance": "build_universal.sh; pinned AArch64 GCC 16.1.0 objects with Buster libc headers; pinned offline Debian Buster image sha256:036c7910ea53bc78cc213452afa92fa83d55de1c51ae54f315af58b5a41a45cf for link and strip",
      "sha256": "97cb0dbd5ac991dfb0d7733e59667804657fc41760ab8bbe34af3b1fb4948e4b",
      "needed": [
        "libEGL.so",
        "libGLESv2.so",
        "libSDL2-2.0.so.0",
        "libc.so.6",
        "libdl.so.2",
        "libgcc_s.so.1",
        "libm.so.6",
        "libpthread.so.0",
        "libz.so.1"
      ],
      "soname": null
    },
    {
      "source": "README.md",
      "target": "deadtrigger/README.md",
      "kind": "payload",
      "mode": "0644",
      "sha256": "29c952287ca9befbb0ceace898c3e3c4c94c6e776b57e12280fe7204430400ab"
    },
    {
      "source": "INSTALLATION.md",
      "target": "deadtrigger/INSTALLATION.md",
      "kind": "payload",
      "mode": "0644",
      "sha256": "aadfdbaa93f98af68122a30dfd405e24b09909a061cc9ebf0ca92a5812a1787c"
    },
    {
      "source": "NOTICE.md",
      "target": "deadtrigger/NOTICE.md",
      "kind": "license-notice",
      "mode": "0644",
      "sha256": "5722117b89cbede7ce30c83d464f5a2960a50f7a7624551ef8f95b681f91377f"
    },
    {
      "source": "DATA-NOTICE.txt",
      "target": "deadtrigger/DATA-NOTICE.txt",
      "kind": "license-notice",
      "mode": "0644",
      "sha256": "b94525099f4d7e029e43df931940c065718ef6ea1ea04ebd76f47305f70a295e"
    },
    {
      "source": "LICENSE",
      "target": "deadtrigger/LICENSE",
      "kind": "license-notice",
      "mode": "0644",
      "sha256": "fd48a1afc565e3b27d07ca190012389f5c0f377abd7285e779c75c58540171ce"
    },
    {
      "source": "version.txt",
      "target": "deadtrigger/version.txt",
      "kind": "payload",
      "mode": "0644",
      "sha256": "6d6b9230dd8b8aac527f8929b7c2fc1fa0365deccca856216de979d6f5c6a6fe"
    },
    {
      "source": "gamedata/README.txt",
      "target": "deadtrigger/gamedata/README.txt",
      "kind": "payload",
      "mode": "0644",
      "sha256": "be905dd76ce2de37664c80c5d426c2f3fef4f52f345ca247d0e1b72050cd07f8"
    },
    {
      "source": "extractor.json",
      "target": "deadtrigger/extractor.json",
      "kind": "nxextract-recipe",
      "mode": "0644",
      "sha256": "03361a5efc93bcc87709bc5fe7aa3dbb1f855e74c4cccb2f5e534dd7c668ee79"
    },
    {
      "source": "nxextract-version.txt",
      "target": "deadtrigger/nxextract-version.txt",
      "kind": "payload",
      "mode": "0644",
      "sha256": "24ee9a7c3f775326bb14c39083745d29f873f21319f1207c06e1f6e9552a720d"
    },
    {
      "source": "nxextract/nxextract.py",
      "target": "deadtrigger/nxextract/nxextract.py",
      "kind": "nxextract",
      "mode": "0644",
      "sha256": "a4a8e5d3bf2a1344491e27921c54430ee9b4e3fedd0160631da96734fa3d5170"
    },
    {
      "source": "nxextract/nxextract-ui",
      "target": "deadtrigger/nxextract/nxextract-ui",
      "kind": "third-party-linux",
      "mode": "0755",
      "architecture": "aarch64",
      "build_profile": "universal-low-glibc",
      "provenance": "unmodified canonical NXExtract 1.2.6 UI; MIT; content-pinned AArch64 GLIBC_2.17 build",
      "sha256": "046afb583f5a211c946495e639409f81d9cfec706788eeccb7924b0e8e5a50b6",
      "needed": [
        "libc.so.6",
        "libdl.so.2"
      ],
      "soname": null
    },
    {
      "source": "nxextract/run-extractor.sh",
      "target": "deadtrigger/nxextract/run-extractor.sh",
      "kind": "nxextract-runner",
      "mode": "0644",
      "sha256": "179b72f02b9dfdf3ed1bdc382d074fb4ef07f83e3d62cfccfc74a950e68679c2"
    },
    {
      "source": "nxextract/nxextract-runtime-env.sh",
      "target": "deadtrigger/nxextract/nxextract-runtime-env.sh",
      "kind": "nxextract-runtime-env",
      "mode": "0644",
      "sha256": "332919a9960d4317563b647f9932d1a4367da147a425fe2f78eafd706f01563f"
    },
    {
      "source": "licenses/NXExtract-MIT.txt",
      "target": "deadtrigger/licenses/NXExtract-MIT.txt",
      "kind": "license-notice",
      "mode": "0644",
      "sha256": "74d7d9d40e27fbfe23cb462f9608fa07cbe53ffb0b88a0da9e85dda240c2c788"
    },
    {
      "source": "port.json",
      "target": "deadtrigger/port.json",
      "kind": "portmaster-metadata",
      "mode": "0644",
      "sha256": "a18a2905c7e6c7ea626911f48f2924db8133a64d8a7903ccc2b47400dc60cd1f"
    },
    {
      "source": "references/adapter-contract-v1.json",
      "target": "deadtrigger/references/adapter-contract-v1.json",
      "kind": "payload",
      "mode": "0644",
      "sha256": "bfb9a3ed82b4638d4b41b2cc580fedcb193a1dc9b3ff15cfe4e94b96ea980794"
    },
    {
      "source": "references/migration-status-v1.json",
      "target": "deadtrigger/references/migration-status-v1.json",
      "kind": "payload",
      "mode": "0644",
      "sha256": "0580c702c48cf8a81b4cd846c71042e069055433528e5cc445ec3127612ab3d2"
    }
  ],
  "exceptions": []
}
